{
  "metadata": {
    "title": "Discover Premium Cannabinoid Products from Binoid",
    "slug": "binoid-cannabinoids",
    "description": "Explore a comprehensive guide to Binoid's award-winning collection of CBD, Delta 9, THCA, THCP, and more. Third-party tested, lab-verified, and designed for quality-conscious users.",
    "keywords": [
      "Binoid",
      "Binoid CBD",
      "Binoid gummies",
      "Binoid discount code",
      "Delta 9 THC",
      "Binoid coupon code",
      "THCA carts",
      "disposable",
      "THCP",
      "THCP vape"
    ],
    "category": "Cannabinoids",
    "badge": "Premium Hemp-Derived Cannabinoids"
  },
  "hero": {
    "headline": "Discover Premium Cannabinoid Products from Binoid",
    "subheadline": "Explore a comprehensive guide to Binoid's award-winning collection of CBD, Delta 9, THCA, THCP, and more. Third-party tested, lab-verified, and designed for quality-conscious users.",
    "cta_primary": {
      "text": "Explore Products",
      "link": "https://www.binoidcbd.com/collections/featured-products",
      "color": "green"
    },
    "cta_secondary": {
      "text": "View Discount Codes",
      "link": "#discounts"
    }
  },
  "features": [
    {
      "icon": "award",
      "title": "Third-Party Tested",
      "description": "All products are lab-verified for potency, purity, and safety. View COAs on our site."
    },
    {
      "icon": "zap",
      "title": "Premium Quality",
      "description": "Crafted from high-quality hemp with precise dosing and consistent effects."
    },
    {
      "icon": "shopping-cart",
      "title": "Fast Shipping",
      "description": "Discreet, fast, and free shipping on all orders. 24/7 customer support."
    }
  ],
  "main_sections": [
    {
      "id": "cannabinoids",
      "title": "Understanding Cannabinoids",
      "subtitle": "Each cannabinoid offers unique effects and benefits. Learn what sets them apart.",
      "type": "tabs",
      "content": [
        {
          "id": "delta9",
          "title": "Delta 9 THC",
          "subtitle": "The Primary Psychoactive Cannabinoid",
          "description": "Delta 9 THC is the main psychoactive compound in cannabis. Hemp-derived Delta 9 is federally legal when it contains less than 0.3% THC by dry weight. It provides a well-balanced, euphoric experience.",
          "highlights": [
            "Delta 9 Gummies (various potencies)",
            "Delta 9 Syrups and Tinctures",
            "Delta 9 Vape Cartridges"
          ],
          "steps": [
            {
              "number": 1,
              "title": "Start Low",
              "description": "Begin with a low dose (5-10mg) to assess tolerance"
            },
            {
              "number": 2,
              "title": "Wait for Effects",
              "description": "Wait 1-2 hours for effects to fully develop"
            },
            {
              "number": 3,
              "title": "Adjust as Needed",
              "description": "Gradually increase as needed for your desired experience"
            }
          ]
        },
        {
          "id": "thca",
          "title": "THCA (Tetrahydrocannabinolic Acid)",
          "subtitle": "The Non-Psychoactive Precursor to THC",
          "description": "THCA is the raw, non-psychoactive form of THC found in fresh cannabis. When heated (decarboxylated), it converts into Delta 9 THC. THCA products are prized for their potency and purity.",
          "highlights": [
            "THCA Carts (Live Rosin, Live Sugar)",
            "THCA Disposables (2-7 grams)",
            "THCA Diamonds and Concentrates",
            "THCA Gummies"
          ],
          "steps": [
            {
              "number": 1,
              "title": "Use Compatible Battery",
              "description": "Use a compatible 510-thread battery for carts"
            },
            {
              "number": 2,
              "title": "Start Small",
              "description": "Start with 1-2 small puffs to gauge potency"
            },
            {
              "number": 3,
              "title": "Allow Time Between Puffs",
              "description": "Allow 5-10 minutes between puffs for full effects"
            }
          ]
        },
        {
          "id": "thcp",
          "title": "THCP (Tetrahydrocannabiphorol)",
          "subtitle": "The Most Potent Cannabinoid Available",
          "description": "THCP is a naturally occurring cannabinoid that is significantly more potent than Delta 9 THC—up to 33 times more active at CB1 receptors. It provides a deep, long-lasting, and intense experience.",
          "highlights": [
            "THCP Vape Cartridges (1-gram)",
            "THCP Gummies",
            "THCP + THCA Blend Disposables"
          ],
          "steps": [
            {
              "number": 1,
              "title": "Extreme Caution",
              "description": "THCP is highly potent—start with a very small amount"
            },
            {
              "number": 2,
              "title": "Minimal Dose",
              "description": "Take only 1 small puff and wait 15+ minutes"
            },
            {
              "number": 3,
              "title": "Experienced Users Only",
              "description": "Only experienced users should use THCP regularly"
            }
          ]
        },
        {
          "id": "cbd",
          "title": "CBD (Cannabidiol)",
          "subtitle": "The Non-Psychoactive Wellness Cannabinoid",
          "description": "CBD is a non-psychoactive cannabinoid known for its potential wellness benefits. It does not produce a \"high\" and is widely used for relaxation, stress relief, and general well-being.",
          "highlights": [
            "CBD Gummies",
            "CBD Tinctures",
            "CBD Vape Cartridges"
          ],
          "steps": [
            {
              "number": 1,
              "title": "Standard Dose",
              "description": "Start with a standard dose (10-20mg)"
            },
            {
              "number": 2,
              "title": "Consistent Use",
              "description": "Take consistently for 2-3 weeks to assess benefits"
            },
            {
              "number": 3,
              "title": "Adjust Dosage",
              "description": "Adjust dosage based on your individual response"
            }
          ]
        }
      ]
    },
    {
      "id": "products",
      "title": "Product Types",
      "subtitle": "Choose the consumption method that works best for you.",
      "type": "cards",
      "content": [
        {
          "title": "Gummies",
          "subtitle": "Edibles with precise dosing",
          "description": "Binoid gummies offer consistent dosing and delicious flavors. Perfect for beginners.",
          "highlights": [
            "Vegan-friendly",
            "Precise dosing (5-100mg per gummy)",
            "Effects last 4-8 hours",
            "Discreet consumption"
          ]
        },
        {
          "title": "Disposables",
          "subtitle": "All-in-one vaping convenience",
          "description": "Ready-to-use vape pens with no setup required. Ideal for on-the-go use.",
          "highlights": [
            "No battery needed",
            "2-7 gram options",
            "Immediate effects (5-15 min)",
            "Portable and discreet"
          ]
        },
        {
          "title": "Vape Carts",
          "subtitle": "Premium cartridges with batteries",
          "description": "Refillable or single-use carts with Live Rosin or Live Sugar infusions.",
          "highlights": [
            "Live Rosin & Live Sugar options",
            "510-thread compatible",
            "Enhanced flavor profile",
            "Reusable batteries available"
          ]
        },
        {
          "title": "Concentrates",
          "subtitle": "Diamonds, Dabs, and Wax",
          "description": "High-potency concentrates for experienced users seeking maximum effects.",
          "highlights": [
            "THCA Diamonds (2500mg+)",
            "Live Rosin & Hash Rosin",
            "Requires dab rig or vaporizer",
            "Maximum potency"
          ]
        }
      ]
    },
    {
      "id": "guides",
      "title": "Beginner's Guide: How to Choose",
      "subtitle": "New to cannabinoids? Follow these steps to find the right product for you.",
      "type": "accordion",
      "content": [
        {
          "title": "Step 1: Identify Your Goal",
          "description": "What are you looking for? Relaxation & Wellness: Start with CBD or low-dose Delta 9 gummies. Mild Euphoria: Try Delta 8 or Delta 9 (5-10mg). Strong Effects: THCA carts or THCA gummies. Maximum Potency: THCP (experienced users only)"
        },
        {
          "title": "Step 2: Choose Your Consumption Method",
          "description": "How do you prefer to consume? Gummies: Slower onset (1-2 hrs), longer duration (4-8 hrs), discreet. Vaping (Carts/Disposables): Fast onset (5-15 min), shorter duration (2-4 hrs), portable. Concentrates: Maximum potency, requires equipment, for experienced users"
        },
        {
          "title": "Step 3: Check Lab Results & Start Low",
          "description": "Safety and quality matter: Always verify the COA (Certificate of Analysis) on Binoid's site. Start with the lowest recommended dose. Wait at least 2 hours before taking more (for edibles). Keep track of how different products affect you"
        }
      ]
    }
  ],
  "resources": {
    "youtube_videos": [
      {
        "title": "What is Delta 9 THC? Complete Beginner's Guide",
        "video_id": "dQw4w9WgXcQ",
        "channel": "Cannabis Education",
        "duration": "8:42",
        "description": "Learn everything you need to know about Delta 9 THC, its effects, legality, and how it differs from other cannabinoids."
      },
      {
        "title": "THCA vs Delta 9: What's the Difference?",
        "video_id": "jNQXAC9IVRw",